{
  "$schema": "../../contracts/ai-radar-daily-signals.schema.json",
  "contrato": "ai-radar.daily-signals.v1",
  "fecha": "2026-06-21",
  "generado_en": "2026-06-21T12:07:40.0817391+02:00",
  "busqueda": {
    "consulta": "5 noticias recientes de IA como senales de AI Radar",
    "idioma": "es",
    "criterio": "Noticias recientes con impacto estrategico, tecnico, regulatorio o de infraestructura para builders.",
    "fuentes_consultadas": [
      "https://www.axios.com/2026/06/20/ai-tech-moguls-g7",
      "https://www.anthropic.com/news/fable-mythos-access",
      "https://deepmind.google/blog/securing-the-future-of-ai-agents/",
      "https://apnews.com/article/power-electricity-ai-plants-data-centers-grid-506e3d206871111f15c3c62fc5368be5",
      "https://openai.com/index/ai-chemist-improves-reaction/"
    ]
  },
  "senales": [
    {
      "id": "g7-ceos-ia-geopolitica",
      "titulo": "Los CEOs de IA entran en la mesa geopolitica del G7",
      "tema": "gobernanza",
      "fuente": {
        "nombre": "Axios",
        "url": "https://www.axios.com/2026/06/20/ai-tech-moguls-g7",
        "publicado": "2026-06-20",
        "consultado": "2026-06-21"
      },
      "evidencia": "Axios reporto que lideres de OpenAI, Google DeepMind, Anthropic, Meta, Mistral y otros participaron en conversaciones del G7 sobre control, reglas, estandares y seguridad de la IA.",
      "impacto": "La IA frontier se esta tratando como infraestructura economica y de seguridad nacional, no solo como una categoria de producto.",
      "accion": "Mantener una watchlist de acuerdos del G7, propuestas de estandarizacion y posiciones regulatorias antes de elegir proveedores frontier para productos criticos.",
      "estado": "alta_prioridad_activo"
    },
    {
      "id": "anthropic-fable-mythos-control-exportacion",
      "titulo": "Anthropic suspende Fable 5 y Mythos 5 por una directiva del gobierno de EE. UU.",
      "tema": "regulacion",
      "fuente": {
        "nombre": "Anthropic",
        "url": "https://www.anthropic.com/news/fable-mythos-access",
        "publicado": "2026-06-12",
        "consultado": "2026-06-21"
      },
      "evidencia": "Anthropic dijo que una directiva de control de exportacion obligaba a suspender el acceso de extranjeros a Fable 5 y Mythos 5, y que la empresa deshabilito ambos modelos para todos sus clientes para cumplir.",
      "impacto": "El acceso a modelos frontier alojados en la nube puede interrumpirse por decisiones regulatorias, incluso sin transferencia de pesos ni despliegues locales.",
      "accion": "Mapear dependencias de modelos cerrados, definir alternativas multi-proveedor y documentar planes de continuidad para usuarios o clientes internacionales.",
      "estado": "riesgo_regulatorio_en_desarrollo"
    },
    {
      "id": "deepmind-control-agentes-ia",
      "titulo": "Google DeepMind publica una hoja de ruta para asegurar agentes de IA",
      "tema": "seguridad de agentes",
      "fuente": {
        "nombre": "Google DeepMind",
        "url": "https://deepmind.google/blog/securing-the-future-of-ai-agents/",
        "publicado": "2026-06-18",
        "consultado": "2026-06-21"
      },
      "evidencia": "DeepMind publico su AI Control Roadmap, que trata agentes internos como posibles amenazas internas y combina monitoreo, permisos graduados, supervision de otros modelos y respuestas sincronas para acciones de mayor riesgo.",
      "impacto": "Los equipos que construyen agentes con herramientas necesitan controles de seguridad operativa, no solo prompts, politicas de uso o evaluaciones offline.",
      "accion": "Agregar logging, sandboxing, permisos minimos, aprobacion humana para acciones irreversibles y monitores de comportamiento en cualquier flujo agentico.",
      "estado": "senal_tecnica_accionable"
    },
    {
      "id": "ferc-red-electrica-data-centers-ia",
      "titulo": "La red electrica se vuelve cuello de botella para data centers de IA",
      "tema": "infraestructura",
      "fuente": {
        "nombre": "Associated Press",
        "url": "https://apnews.com/article/power-electricity-ai-plants-data-centers-grid-506e3d206871111f15c3c62fc5368be5",
        "publicado": "2026-06-18",
        "consultado": "2026-06-21"
      },
      "evidencia": "AP informo que FERC ordeno a seis operadores regionales acelerar la conexion de grandes usuarios como data centers de IA y pedir planes de respuesta en plazos de 30 a 60 dias.",
      "impacto": "La disponibilidad, precio y latencia del compute dependeran cada vez mas de energia, permisos, interconexion de red y negociacion local.",
      "accion": "Rastrear regiones con capacidad energetica, politicas de interconexion y proveedores con acuerdos de energia propia o cargas flexibles.",
      "estado": "infraestructura_critica_activo"
    },
    {
      "id": "openai-quimico-autonomo-medicinal",
      "titulo": "OpenAI muestra un agente casi autonomo que mejora una reaccion de quimica medicinal",
      "tema": "investigacion aplicada",
      "fuente": {
        "nombre": "OpenAI",
        "url": "https://openai.com/index/ai-chemist-improves-reaction/",
        "publicado": "2026-06-17",
        "consultado": "2026-06-21"
      },
      "evidencia": "OpenAI reporto que GPT-5.4, conectado a Maria de Molecule.one, propuso y ejecuto ciclos experimentales que mejoraron rendimientos en una reaccion Chan-Lam para mas del 80% de los sustratos probados.",
      "impacto": "La automatizacion cientifica esta pasando de demos de razonamiento a bucles de investigacion con laboratorio, datos experimentales y validacion humana.",
      "accion": "Identificar flujos internos donde un agente pueda proponer experimentos, ejecutar tareas acotadas y producir resultados auditables con humanos en el ciclo.",
      "estado": "estrategica_emergente"
    }
  ]
}
